{
  "analyzer_executions": [
    {
      "analyzer_execution_id": "core_analyzer_execution_621738525490b7b0383353ba",
      "analyzer_id": "java-type-structure-analyzer",
      "analyzer_version": "0.44.23a7",
      "artifact_ids": [
        "java_type_structure_c008ec60952c1514402207dc"
      ],
      "attempts": [
        {
          "attempt": 1,
          "process": {
            "command": [
              "code-analyzer-core",
              "evidence-execute",
              "--repository",
              "/mnt/data/data_model_enrichment_work/tiny-no-storage",
              "--request",
              "/mnt/data/data_model_enrichment_work/ucp_e2e/analysis/tiny-data-model-no-storage/build-data-model-v1/2026-08-17T16-54-39Z__job-9084be7b/knowledge-execution/execution-nodes/001-source-source_snapshot_b626edcb68c724ed7f8b0b78/core-evidence-execution-request.json",
              "--output",
              "/mnt/data/data_model_enrichment_work/ucp_e2e/analysis/tiny-data-model-no-storage/build-data-model-v1/2026-08-17T16-54-39Z__job-9084be7b/knowledge-execution/execution-nodes/001-source-source_snapshot_b626edcb68c724ed7f8b0b78/core-evidence",
              "--repo-id",
              "tiny-no-storage"
            ],
            "command_display": "code-analyzer-core evidence-execute --repository /mnt/data/data_model_enrichment_work/tiny-no-storage --request /mnt/data/data_model_enrichment_work/ucp_e2e/analysis/tiny-data-model-no-storage/build-data-model-v1/2026-08-17T16-54-39Z__job-9084be7b/knowledge-execution/execution-nodes/001-source-source_snapshot_b626edcb68c724ed7f8b0b78/core-evidence-execution-request.json --output /mnt/data/data_model_enrichment_work/ucp_e2e/analysis/tiny-data-model-no-storage/build-data-model-v1/2026-08-17T16-54-39Z__job-9084be7b/knowledge-execution/execution-nodes/001-source-source_snapshot_b626edcb68c724ed7f8b0b78/core-evidence --repo-id tiny-no-storage",
            "elapsed_seconds": 2.003,
            "log": "logs/core-evidence.log",
            "max_rss_kb": 129988,
            "returncode": 0,
            "stack_dump_requests": 0,
            "timed_out": false
          },
          "status": "completed"
        }
      ],
      "parameters": {},
      "request_provenance": {
        "batching_policy": "same_source_snapshot_missing_nodes_single_core_request",
        "core_evidence_catalog_fingerprint": "001d1a74dae33c7cff3a220e5cef4e270c65d3b87533c0429c5b95d5a8a8718c",
        "execution_node_ids": [
          "analyzer:java-model-storage-analyzer:tiny-no-storage",
          "analyzer:java-type-structure-analyzer:tiny-no-storage"
        ],
        "knowledge_execution_plan_fingerprint": "77909599eaff8b628d1988b74a5bbdeb38141ab3cd17d188334ef684d3d7e9a4",
        "knowledge_profile_id": "data-model-v1",
        "semantic_role": "execution_request_provenance_only"
      },
      "required_by": [
        "code-declared-data-model"
      ],
      "semantic_outputs": [
        {
          "artifact_kind": "java-type-structure-evidence",
          "schema_version": "java-type-structure-evidence/v1"
        }
      ],
      "source_snapshot_fingerprints": [
        "95d2c8469e565caaa82b64cb333e3d5b23e8db0d21089e4c6a3af52acbece421"
      ],
      "source_snapshot_ids": [
        "tiny-no-storage"
      ],
      "status": "completed"
    },
    {
      "analyzer_execution_id": "core_analyzer_execution_34527bbe985e6d4bc1e9c021",
      "analyzer_id": "java-model-storage-analyzer",
      "analyzer_version": "0.44.23a7",
      "artifact_ids": [
        "model_storage_7928a7017ad0c9cf2f03ffcb"
      ],
      "attempts": [
        {
          "attempt": 1,
          "process": {
            "command": [
              "code-analyzer-core",
              "evidence-execute",
              "--repository",
              "/mnt/data/data_model_enrichment_work/tiny-no-storage",
              "--request",
              "/mnt/data/data_model_enrichment_work/ucp_e2e/analysis/tiny-data-model-no-storage/build-data-model-v1/2026-08-17T16-54-39Z__job-9084be7b/knowledge-execution/execution-nodes/001-source-source_snapshot_b626edcb68c724ed7f8b0b78/core-evidence-execution-request.json",
              "--output",
              "/mnt/data/data_model_enrichment_work/ucp_e2e/analysis/tiny-data-model-no-storage/build-data-model-v1/2026-08-17T16-54-39Z__job-9084be7b/knowledge-execution/execution-nodes/001-source-source_snapshot_b626edcb68c724ed7f8b0b78/core-evidence",
              "--repo-id",
              "tiny-no-storage"
            ],
            "command_display": "code-analyzer-core evidence-execute --repository /mnt/data/data_model_enrichment_work/tiny-no-storage --request /mnt/data/data_model_enrichment_work/ucp_e2e/analysis/tiny-data-model-no-storage/build-data-model-v1/2026-08-17T16-54-39Z__job-9084be7b/knowledge-execution/execution-nodes/001-source-source_snapshot_b626edcb68c724ed7f8b0b78/core-evidence-execution-request.json --output /mnt/data/data_model_enrichment_work/ucp_e2e/analysis/tiny-data-model-no-storage/build-data-model-v1/2026-08-17T16-54-39Z__job-9084be7b/knowledge-execution/execution-nodes/001-source-source_snapshot_b626edcb68c724ed7f8b0b78/core-evidence --repo-id tiny-no-storage",
            "elapsed_seconds": 2.003,
            "log": "logs/core-evidence.log",
            "max_rss_kb": 129988,
            "returncode": 0,
            "stack_dump_requests": 0,
            "timed_out": false
          },
          "status": "completed"
        }
      ],
      "parameters": {},
      "request_provenance": {
        "batching_policy": "same_source_snapshot_missing_nodes_single_core_request",
        "core_evidence_catalog_fingerprint": "001d1a74dae33c7cff3a220e5cef4e270c65d3b87533c0429c5b95d5a8a8718c",
        "execution_node_ids": [
          "analyzer:java-model-storage-analyzer:tiny-no-storage",
          "analyzer:java-type-structure-analyzer:tiny-no-storage"
        ],
        "knowledge_execution_plan_fingerprint": "77909599eaff8b628d1988b74a5bbdeb38141ab3cd17d188334ef684d3d7e9a4",
        "knowledge_profile_id": "data-model-v1",
        "semantic_role": "execution_request_provenance_only"
      },
      "required_by": [],
      "semantic_outputs": [
        {
          "artifact_kind": "model-storage-evidence",
          "schema_version": "model-storage-evidence/v1"
        }
      ],
      "source_snapshot_fingerprints": [
        "5ab330b68abed4da061616e0d83f4ba5f39ddc732a3e28abd8de43ae64c0b048"
      ],
      "source_snapshot_ids": [
        "tiny-no-storage"
      ],
      "status": "completed"
    }
  ],
  "catalogs": {
    "core_evidence_contract_catalog_fingerprint": "001d1a74dae33c7cff3a220e5cef4e270c65d3b87533c0429c5b95d5a8a8718c",
    "knowledge_materialization_catalog_fingerprint": "a513e518ef7398a413a7e13453badd733c0b41a97a39aa63b40e2cd7e6d14bab"
  },
  "completed_at": "2026-08-17T16:54:51.359742+00:00",
  "diagnostics": [],
  "evidence_artifacts": [
    {
      "artifact_id": "model_storage_7928a7017ad0c9cf2f03ffcb",
      "artifact_kind": "model-storage-evidence",
      "content_fingerprint": "7928a7017ad0c9cf2f03ffcb5fd7daa78b78b39346849d3d6aad373b0970ecfc",
      "contract_version": "core_evidence_artifact_contract/v1",
      "coverage": {
        "alias_api_observed": false,
        "coverage_status": "not_applicable",
        "interpreter_observation_count": 0,
        "java_files_discovered": 1,
        "key_api_observed": false,
        "reference_api_observed": false,
        "reference_value_derivations_count": 0,
        "source_observation_count": 0,
        "storage_key_lineage_count": 0,
        "storage_records_count": 0,
        "storage_references_count": 0
      },
      "diagnostics": {
        "code_counts": {},
        "count": 0,
        "severity_counts": {}
      },
      "location": {
        "bytes": 2083,
        "kind": "file",
        "path": "/mnt/data/data_model_enrichment_work/ucp_e2e/control-plane/producer-artifacts/core-repository-evidence/6be4e19645c58908afc765cc041ba61613da8eefb76e072f5651e429614c1297/payload/core-evidence/evidence/model-storage-evidence.json",
        "sha256": "6fe35cf9f7476e3e1b899a5be3a3e54feb71e17df84be1209d75920e3db8ae46"
      },
      "producer_analyzer_execution_id": "core_analyzer_execution_34527bbe985e6d4bc1e9c021",
      "provenance": {
        "core_artifact_provenance": {
          "execution_runtime": "core_evidence_runtime/v1",
          "framework_interpreter": "code_analyzer_core.tsa_interpreter.interpret_tsa_facts",
          "inference_policy": "observed_framework_api_bindings_only_no_physical_mapping_or_business_verdict",
          "interpreter_status": {},
          "observation_source": "code_analyzer_core.scanners.java_source_observations.build_java_source_observation_facts",
          "parser_provider": "tree_sitter",
          "semantic_routing": "artifact_kind_plus_schema_version"
        },
        "core_execution_result": "core-evidence/core-evidence-execution-result.json",
        "foundation": {
          "contract_version": "java_source_observations/internal",
          "fingerprint": null,
          "sections": [
            "java_source_observations"
          ],
          "used": true
        },
        "producer": {
          "analyzer_id": "java-model-storage-analyzer",
          "analyzer_version": "0.44.23a7",
          "component": "code-analyzer-core"
        },
        "request": {
          "batching_policy": "same_source_snapshot_missing_nodes_single_core_request",
          "core_evidence_catalog_fingerprint": "001d1a74dae33c7cff3a220e5cef4e270c65d3b87533c0429c5b95d5a8a8718c",
          "execution_node_ids": [
            "analyzer:java-model-storage-analyzer:tiny-no-storage",
            "analyzer:java-type-structure-analyzer:tiny-no-storage"
          ],
          "knowledge_execution_plan_fingerprint": "77909599eaff8b628d1988b74a5bbdeb38141ab3cd17d188334ef684d3d7e9a4",
          "knowledge_profile_id": "data-model-v1",